Dainty's Apple &amp Mango 10ml ,73
Psycho Bunny Nicotine Shot VG Base,52
Eco Vape Premium Rolling Tobacco V2 Flavour,46
Dainty's Premium Blueberry Blackcurrant Menthol 50/50 80ML,38
Dainty's Cherry Menthol Flavour MAX VG 50ml,33
Dainty's Pink Lemonade 10ml ,32
Dainty's Premium Heizenberg 50/50 80ML,32
Dainty's Blue Slush 10ml,32
Dainty's RY4 Tobacco 10ml,32
Psycho Bunny Double Ice Nicotine Shot ,30
Dainty's Blackcurrant Menthol 10ml,29
Eco Vape Premium Blackcurrant Menthol V2 Flavour,28
Dripping Range Wolves Juice Flavour 50/50,24
Dripping Range Blue Slush Flavour 50/50,22
Dainty's Tutti Fruity 10ml,22
Dainty's Special Menthol 10ml,20
Dainty's Heizenberg Flavour MAX VG 50ml,19
Dainty's Apple 10ml,18
Dripping Range Vampire Astaire Flavour 50/50,17
Psycho Bunny Ice Nicotine Shot ,17
Dripping Range Zombie Astaire Flavour 50/50,16
Dainty's Premium Menthol 50/50 80ML,16
Dainty's Heisenberg 10ml,16
Dainty's Premium Pink Lemonade 50/50 80ML,16
Dainty's Red Air 10ml,15
Dainty's Bubblegum Blast 50ml,15
Dainty's Orange 10ml,15
Dainty's Special Menthol Flavours MAX VG 50ml,14
Dainty's Premium Red Air 50/50 80ML,14
Dainty's Fresh Orange 10ml,12
Dainty's Premium Red Air 70/30 50ML,12
Dainty's Grape &amp Blackcurrant 10ml ,12
Dainty's Premium Grape &amp Blackcurrant 50/50 80ML ,11
Eco Vape Premium Gold Tobacco V2 Flavour,11
Dainty's Menthol 10ml,11
Eco Vape Milfman V2 Milkshake Flavour MAX VG 50ml,11
Award Winning Eco Vape Milfsmilk V2 Flavour MAX VG 50ml,11
Dainty's Raspberry 10ml,11
Dainty's Premium RY4 Caramel Vanilla Tobacco 50/50 80ML,11
Dainty's Apple &amp Mango Flavour MAX VG 50ml ,11
Dainty's Bubblegum 10ml,9
Dainty's Cherry Lemonade Flavour MAX VG 50ml,9
Dainty's Nic Salts Apple &amp Mango 10ml ,9
Psycho Bunny Nicotine Shot PG Base,9
Dainty's Strawberry 10ml,9
Dainty's Cola 10ml,8
Dripping Range Green Slush V2 Flavour 50/50,8
Dripping Range Vampire Astaire Flavour MAX VG 50ml,8
Dripping Range Cobra Venom Flavour 50/50,8
Dainty's Premium Foam Banana 50/50 80ML,8
Dainty's Aniseed 10ml,8
Eco Vape Premium Strawberry &amp Watermelon V2 Flavour ,7
Dainty's Nic Salts Blueberry 10ml,7
Eco Vape Premium Rhubarb &amp Custard Flavour ,7
Dainty's Banana 10ml,7
Eco Vape Premium Spearmint V2 Flavour,6
Dripping Range Killa Custard V2 Flavour 50/50,6
Dripping Range Blue Slush MAX VG 50ml,6
Psycho Bunny Prism Flavour MAX VG 50ML,6
Dainty's Blueberry Pancake 50ml,6
Dainty's Banana Cake Flavour MAX VG 50ml,6
Psycho Bunny Blue Retro Flavour MAX VG 50ML ,6
Eco Vape Premium Sweet Cherry V2 Flavour,6
Dainty's Cookie 10ml,6
Dainty's Premium Vanilla Ice Cream 50/50 80ML,5
Dainty's Cherry Menthol 10ml,5
Dainty's Nic Salts Pink Lemonade 10ml,5
Dainty's Irish Cream 10ml,5
Dripping Range Unicorn Blood Flavour 50/50,5
Dainty's Raspberry Sherbet 50ml,5
Eco Vape Premium Apple &amp Mango V2 Flavour ,5
Eco Vape Premium Cherry Menthol V2 Flavour,5
Dainty's Premium Ice Mint 50/50 80ML,4
Eco Vape Premium Forest Fruits V2 Flavour,4
Eco Vape Premium Tutti Fruity V2 Flavour,4
Dainty's Cola Cube 10ml,4
Dainty's Strawberry Cheesecake Flavour MAX VG 50ml,4
Dainty's Nic Salts Cherry Lemonade 10ml,4
SMOKJOY OPS-1 Replacement Pod ,4
Dainty's Peppermint 10ml,3
Eco Vape Premium Dragon Fruit V2 Flavour,3
Famovape Fat Baby Mesh Coils,3
Dainty's Apple Pie Flavours MAX VG 50ml,3
Psycho Bunny Serial Flavour MAX VG 50ML ,3
Psycho Bunny Cappuccino Flavour MAX VG 50ML ,3
Dainty's Nic Salts Grape and Blackcurrant 10ml,2
Dainty's Jelly Babies 10ml,2
Psycho Bunny Thorn 50ml ,2
Dainty's Iron Brew 10ml,2
Eco Vape Premium Candyfloss V2 Flavour,2
Dainty's Vanilla Ice Cream 10ml,2
Psycho Bunny Melonade Flavour MAX VG 50ML,2
Vaptio Paragon Coils,2
Psycho Bunny Custard Appeal Flavour MAX VG 50ML,2
Eco Vape Premium Fruit Salad V2 Flavour,2
Dainty's Nic Salts Blueberry and Blackcurrant Menthol 10ml,2
Dainty's Coffee 10ml,2
Rincoe Ceto Replacement Pod,2
Dripping Range Blueberg MAX VG 50ml,2
Award Winning Eco Vape Strawberry Milkshake V2 Flavour MAX VG 50ml,2
Eco Vape Premium Bubblegum V2 Flavour,2
Eco Vape Premium Black Jack V2 Flavour,2
Rincoe Ceto,1
LADY Q COILS,1
Vaptio P1 Mini Starter Kit ,1
Vaptio Cosmo Kit,1
Dainty's Ice Mint 10ml,1
Dainty's Key Lime Pie 10ml,1
Dainty's Pineapple 10ml,1
Dainty's Lemon Cola Flavour MAX VG 50ml,1
Vaptio Frogman Tank,1
Eco Vape Banana Milkshake V2 Flavour MAX VG 50ml,1
Vaptio Paragon C2 Kit,1
VivaKita Move 60 Vaping Kit,1
Psycho Bunny Grapegasm Flavour MAX VG 50ML ,1
Psycho Bunny Twister 50ml ,1
VooPoo Drag 2 Mini 117w Kit,1
Dainty's Grapefruit 10ml,1
Vaptio Solo-Flat Replacement Pod Cartridge ,1
Dainty's Black Jack 10ml,1
Dainty's Blueberry 10ml,1
Eco Vape Premium Peach V2 Flavour,1
Vaptio Solo F2 AIO,1
Eco Vape Premium Menthol Flavour,1
Psycho Bunny O.J Flavour MAX VG 50ML ,1
Dainty's Fruit Salad 10ml,1
Dripping Range Rainbow Sherbert Ice Cream MAX VG 50ml,1
Dripping Range Liquid Do-Nuts Toffee V2 Flavour 50/50,1
Dainty's Cherry 10ml,1
Dainty's Strawberry Cheesecake 10ml,1
Dripping Range Banananutz MAX VG 50ml,1
Dainty's Apple Pie 10ml,1
Dainty's Nic Salts Bubblegum Blast 10ml,1
